{
  "msp_version": "0.1.0",
  "manifest_version": "0.1.0",
  "kind": "SkillManifest",
  "id": "skill.rust.refactor.module.v1",
  "name": "Rust Module Refactor",
  "version": "0.1.0",
  "category": "software_engineering/rust/refactoring",
  "summary": "Guides safe refactoring of Rust modules using small edits and verification loops.",
  "description": "A reference MSP skill for behavior-preserving Rust module refactors.",
  "keywords": ["rust", "refactor", "module", "tests", "format"],
  "formats": ["markdown"],
  "primary_format": "markdown",
  "activation": {
    "task_patterns": [
      "refactor rust module",
      "refactor a rust module",
      "clean up rust module",
      "split rust module"
    ],
    "negative_patterns": ["rewrite from scratch"],
    "required_context": ["workspace"],
    "optional_context": ["test_command", "module_path"],
    "domains": ["software_engineering"],
    "languages": ["rust"]
  },
  "requirements": {
    "model_capabilities": ["code_generation", "tool_use"],
    "runtime_capabilities": ["workspace_read", "workspace_write"],
    "tools": [
      {
        "name": "read_file",
        "required": true,
        "purpose": "Inspect current Rust source."
      },
      {
        "name": "write_file",
        "required": true,
        "purpose": "Apply source edits."
      },
      {
        "name": "run_command",
        "required": false,
        "purpose": "Run formatter and tests."
      }
    ],
    "permissions": ["workspace_read", "workspace_write"],
    "min_context_window": 8192,
    "supported_platforms": ["linux", "macos", "windows"]
  },
  "schemas": {
    "input": "msp://schemas/rust_refactor_request.v1",
    "output": "msp://schemas/implementation_report.v1"
  },
  "verification": {
    "contract": "verify.json",
    "required_checks": ["fmt_passed", "tests_passed", "changes_reported"],
    "optional_checks": [],
    "minimum_evidence": ["commands", "files_changed"]
  },
  "trust": {
    "hash": "sha256:1ef70dc4eda7afd2216e2c0bc51f6a6ab7ad15019db9510f15e19bdfe2d221d2",
    "signed": false,
    "issuer": "msp-reference.local",
    "license": "MIT",
    "review_status": "self_reviewed",
    "risk_level": "medium",
    "forbidden_behaviors": [
      "override_host_policy",
      "override_user_policy",
      "grant_tool_permissions",
      "silently_load_dependencies",
      "alter_memory_policy",
      "alter_identity_policy"
    ],
    "sandbox_profile": "workspace_edit"
  },
  "dependencies": [],
  "artifacts": {
    "body": {
      "uri": "skill.md",
      "media_type": "text/markdown",
      "hash": "sha256:1ef70dc4eda7afd2216e2c0bc51f6a6ab7ad15019db9510f15e19bdfe2d221d2",
      "size_bytes": 858
    },
    "verification_contract": {
      "uri": "verify.json",
      "media_type": "application/json",
      "hash": "sha256:5552502f3179c4b400336bd8eeaaacd9720e856c2f1a14262a097bd243dd26c6",
      "size_bytes": 1304
    }
  },
  "provenance": {
    "author": "Honorbound Innovation",
    "generator": "Vegvisir",
    "source_documents": ["spec.md", "plan.md"],
    "generated_at": "2026-06-24T00:00:00Z",
    "published_at": "2026-06-24T00:00:00Z"
  },
  "compatibility": {
    "min_msp_version": "0.1.0",
    "known_runtimes": ["msp-reference", "vegvisir"]
  },
  "deprecation": {
    "deprecated": false
  }
}
